{
  "documentType": "yabt.backupRoot",
  "schemaVersion": 1,
  "rootRole": "source",
  "archiveId": "018fc4c7-8ec8-7cf4-b5cb-5e31d5d8d15a",
  "name": "Personal archive",
  "createdAtUtc": "2026-05-28T18:30:00Z",
  "layout": {
    "livePrefix": "live",
    "histPrefix": "hist"
  },
  "stores": [
    {
      "id": "local-archive",
      "kind": "fileSystem",
      "rootPath": "E:\\Archive"
    },
    {
      "id": "main-azure",
      "kind": "azureBlob",
      "accountUri": "https://example.blob.core.windows.net",
      "container": "archive",
      "prefix": "personal",
      "credentialRef": "main-azure"
    },
    {
      "id": "pcloud",
      "kind": "webDav",
      "endpoint": "https://webdav.pcloud.com",
      "rootPath": "/YABT",
      "credentialRef": "pcloud-main"
    }
  ]
}
